{
  "$schema": "../../../../content/schemas/workshops.schema.json",
  "version": "1.0.0",
  "_comment": "Stoneworks merged with Lime & Concrete Yard for Builder profession",
  "workshops": [
    {
      "id": "core_construction_workshop_stoneworks",
      "name": "Stoneworks & Builder's Yard",
      "description": "Workshop for stonework AND building materials (lime, concrete, mortar)",
      "tags": [
        "stone",
        "cutting",
        "shaping",
        "engraving",
        "lime",
        "mortar",
        "concrete",
        "aggregate",
        "recycling"
      ],
      "era_min": "C",
      "era_max": "R",
      "attachment_slots": [
        "cutting",
        "forming",
        "engraving",
        "kiln",
        "slaker",
        "formwork",
        "crushing",
        "neutralizer"
      ],
      "io": {
        "input_slots": 4,
        "output_slots": 4,
        "buffer_slots": 2
      },
      "power_baseline_w": 0,
      "category": "workshop",
      "build_time_ticks": 1200,
      "material_costs": [
        {
          "tag": "block",
          "count": 8
        },
        {
          "tag": "plank",
          "count": 4
        }
      ],
      "placeable_profile": {
        "footprint": {
          "w": 5,
          "d": 5,
          "h": 1
        },
        "passability": "nonblocking",
        "requires_floor": true,
        "clearance_h": 3,
        "blocks_light": false,
        "tags": [
          "workshop",
          "stoneworks"
        ],
        "effects": {
          "beauty": -1,
          "comfort": 0,
          "light_lumen": 0,
          "heat_w": 0
        }
      }
    }
  ],
  "attachments": [
    {
      "id": "core_attach_stone_cut_handbench",
      "name": "Hand Cleaving Bench",
      "slot": "cutting",
      "era": "C",
      "upgrade_to": "core_attach_stone_cut_watersaw",
      "tags": [
        "cut"
      ],
      "power_w": 0
    },
    {
      "id": "core_attach_stone_cut_watersaw",
      "name": "Water-Powered Stone Saw",
      "slot": "cutting",
      "era": "M",
      "upgrade_to": "core_attach_stone_cut_framesaw_polisher",
      "tags": [
        "cut",
        "waterpower"
      ],
      "power_w": 150
    },
    {
      "id": "core_attach_stone_cut_framesaw_polisher",
      "name": "Frame Saw & Polisher",
      "slot": "cutting",
      "era": "R",
      "upgrade_to": null,
      "tags": [
        "cut",
        "polish",
        "waterpower"
      ],
      "power_w": 250
    },
    {
      "id": "core_attach_stone_form_chisel_rack",
      "name": "Chiseling Rack",
      "slot": "forming",
      "era": "C",
      "upgrade_to": "core_attach_stone_form_hoist_jigs",
      "tags": [
        "form"
      ],
      "power_w": 0
    },
    {
      "id": "core_attach_stone_form_hoist_jigs",
      "name": "Hoist & Positioning Jigs",
      "slot": "forming",
      "era": "M",
      "upgrade_to": "core_attach_stone_form_template_lathe",
      "tags": [
        "form",
        "rigging"
      ],
      "power_w": 0
    },
    {
      "id": "core_attach_stone_form_template_lathe",
      "name": "Templates, Lathe & Grinder",
      "slot": "forming",
      "era": "R",
      "upgrade_to": null,
      "tags": [
        "form",
        "lathe",
        "waterpower"
      ],
      "power_w": 250
    },
    {
      "id": "core_attach_stone_engrave_bench",
      "name": "Inscription Bench",
      "slot": "engraving",
      "era": "C",
      "upgrade_to": "core_attach_stone_engrave_tracing_gauges",
      "tags": [
        "engrave"
      ],
      "power_w": 0
    },
    {
      "id": "core_attach_stone_engrave_tracing_gauges",
      "name": "Tracing Gauges",
      "slot": "engraving",
      "era": "M",
      "upgrade_to": "core_attach_stone_engrave_fine_polish",
      "tags": [
        "engrave",
        "measure"
      ],
      "power_w": 0
    },
    {
      "id": "core_attach_stone_engrave_fine_polish",
      "name": "Fine Carve & Polish Set",
      "slot": "engraving",
      "era": "R",
      "upgrade_to": null,
      "tags": [
        "engrave",
        "polish"
      ],
      "power_w": 0
    },
    {
      "id": "core_attach_kiln_pit_clamp",
      "name": "Pit/Clamp Kiln",
      "slot": "kiln",
      "era": "C",
      "upgrade_to": "core_attach_kiln_shaft_draft",
      "tags": [
        "calcination"
      ],
      "power_w": 0
    },
    {
      "id": "core_attach_kiln_shaft_draft",
      "name": "Shaft/Draft Kiln",
      "slot": "kiln",
      "era": "M",
      "upgrade_to": "core_attach_kiln_twin_chamber_continuous",
      "tags": [
        "calcination"
      ],
      "power_w": 0
    },
    {
      "id": "core_attach_kiln_twin_chamber_continuous",
      "name": "Twin-Chamber Continuous Kiln",
      "slot": "kiln",
      "era": "R",
      "upgrade_to": null,
      "tags": [
        "calcination"
      ],
      "power_w": 0
    },
    {
      "id": "core_attach_slaker_pool_open",
      "name": "Open Slaking Pool",
      "slot": "slaker",
      "era": "C",
      "upgrade_to": "core_attach_slaker_pool_covered",
      "tags": [
        "slaking"
      ],
      "power_w": 0
    },
    {
      "id": "core_attach_slaker_pool_covered",
      "name": "Covered Slaking Pool",
      "slot": "slaker",
      "era": "M",
      "upgrade_to": "core_attach_slaker_pool_series",
      "tags": [
        "slaking"
      ],
      "power_w": 0
    },
    {
      "id": "core_attach_slaker_pool_series",
      "name": "Series Slaking Pools",
      "slot": "slaker",
      "era": "R",
      "upgrade_to": null,
      "tags": [
        "slaking"
      ],
      "power_w": 0
    },
    {
      "id": "core_attach_formwork_manual",
      "name": "Manual Formwork & Mixing",
      "slot": "formwork",
      "era": "C",
      "upgrade_to": "core_attach_formwork_rig_shed",
      "tags": [
        "mixing",
        "formwork"
      ],
      "power_w": 0
    },
    {
      "id": "core_attach_formwork_rig_shed",
      "name": "Rig/Scaffold & Mixing Shed",
      "slot": "formwork",
      "era": "M",
      "upgrade_to": "core_attach_formwork_adjustable_drum",
      "tags": [
        "mixing",
        "formwork"
      ],
      "power_w": 0
    },
    {
      "id": "core_attach_formwork_adjustable_drum",
      "name": "Adjustable Formwork & Drum Mixer",
      "slot": "formwork",
      "era": "R",
      "upgrade_to": null,
      "tags": [
        "mixing",
        "formwork"
      ],
      "power_w": 0
    },
    {
      "id": "core_attach_crush_sieve_hand",
      "name": "Hand Crushing & Sieve",
      "slot": "crushing",
      "era": "C",
      "upgrade_to": "core_attach_crush_water_helve_coarse",
      "tags": [
        "crushing",
        "screening"
      ],
      "power_w": 0
    },
    {
      "id": "core_attach_crush_water_helve_coarse",
      "name": "Water Helve + Coarse Screen",
      "slot": "crushing",
      "era": "M",
      "upgrade_to": "core_attach_crush_roller_and_drum",
      "tags": [
        "crushing",
        "screening",
        "powered"
      ],
      "power_w": 150
    },
    {
      "id": "core_attach_crush_roller_and_drum",
      "name": "Roller Crusher + Drum Sieve",
      "slot": "crushing",
      "era": "R",
      "upgrade_to": null,
      "tags": [
        "crushing",
        "screening",
        "powered"
      ],
      "power_w": 250
    },
    {
      "id": "core_attach_neutralizer_basin",
      "name": "Neutralizer Basin",
      "slot": "neutralizer",
      "era": "M",
      "upgrade_to": "core_attach_neutralizer_continuous_filter",
      "tags": [
        "neutralization",
        "recycling"
      ],
      "power_w": 0
    },
    {
      "id": "core_attach_neutralizer_continuous_filter",
      "name": "Continuous Neutralizer & Filter Rack",
      "slot": "neutralizer",
      "era": "R",
      "upgrade_to": null,
      "tags": [
        "neutralization",
        "recycling"
      ],
      "power_w": 0
    }
  ]
}